{
  "schemaVersion": "1.0.0",
  "generatedAt": "2026-07-15T00:00:00Z",
  "policySetId": "StellaSoraLifecycleLanePolicySet",
  "policySetVersion": "1.0.0",
  "policies": [
    {
      "policyId": "ActorPolicyV1",
      "lane": "Actor",
      "policyVersion": "1.0.0",
      "familyKinds": [
        {
          "familyKindId": "ActorRouteFamily",
          "applicableObjectTypes": [
            "AnimationClip",
            "AnimatorController",
            "Avatar",
            "SkinnedMeshRenderer"
          ],
          "keyDimensionIds": [
            "ActorRole",
            "AnimationSetShapeId",
            "AvatarId",
            "ControllerReferenceState",
            "ObjectType",
            "RendererType",
            "ShaderFamilyIds",
            "SkeletonId"
          ],
          "memberSelectorKinds": [
            "CanonicalAssetId",
            "ClassId",
            "DependencyObjectId",
            "ObjectType",
            "PlatformVariant",
            "ToolObservation"
          ]
        }
      ],
      "factDefinitions": [
        {
          "factKind": "ActorRole",
          "valueKind": "String",
          "requiredForFamilyKinds": [
            "ActorRouteFamily"
          ],
          "allowedValues": [
            "Enemy",
            "Other",
            "Player"
          ],
          "allowNotApplicable": false
        },
        {
          "factKind": "AnimationSetShapeId",
          "valueKind": "String",
          "requiredForFamilyKinds": [
            "ActorRouteFamily"
          ],
          "allowedValues": [],
          "allowNotApplicable": true
        },
        {
          "factKind": "AvatarId",
          "valueKind": "String",
          "requiredForFamilyKinds": [
            "ActorRouteFamily"
          ],
          "allowedValues": [],
          "allowNotApplicable": true
        },
        {
          "factKind": "ControllerReferenceState",
          "valueKind": "String",
          "requiredForFamilyKinds": [
            "ActorRouteFamily"
          ],
          "allowedValues": [
            "Missing",
            "Present",
            "PrototypeRequired"
          ],
          "allowNotApplicable": true
        },
        {
          "factKind": "DependencyObjectIds",
          "valueKind": "IdSet",
          "requiredForFamilyKinds": [
            "ActorRouteFamily"
          ],
          "allowedValues": [],
          "allowNotApplicable": false
        },
        {
          "factKind": "ObjectType",
          "valueKind": "String",
          "requiredForFamilyKinds": [
            "ActorRouteFamily"
          ],
          "allowedValues": [
            "AnimationClip",
            "AnimatorController",
            "Avatar",
            "SkinnedMeshRenderer"
          ],
          "allowNotApplicable": false
        },
        {
          "factKind": "PlatformVariant",
          "valueKind": "String",
          "requiredForFamilyKinds": [
            "ActorRouteFamily"
          ],
          "allowedValues": [
            "Android",
            "Pc",
            "Unknown"
          ],
          "allowNotApplicable": false
        },
        {
          "factKind": "RendererType",
          "valueKind": "String",
          "requiredForFamilyKinds": [
            "ActorRouteFamily"
          ],
          "allowedValues": [],
          "allowNotApplicable": true
        },
        {
          "factKind": "ShaderFamilyIds",
          "valueKind": "IdSet",
          "requiredForFamilyKinds": [
            "ActorRouteFamily"
          ],
          "allowedValues": [],
          "allowNotApplicable": true
        },
        {
          "factKind": "SkeletonId",
          "valueKind": "String",
          "requiredForFamilyKinds": [
            "ActorRouteFamily"
          ],
          "allowedValues": [],
          "allowNotApplicable": true
        }
      ],
      "staticCheckDefinitions": [
        {
          "checkId": "AnimationClipReadability",
          "applicableFamilyKinds": [
            "ActorRouteFamily"
          ],
          "requiredFactKinds": [
            "AnimationSetShapeId"
          ],
          "outcomeOnMissingFact": "Unchecked",
          "requiredEvidenceKinds": [
            "FileReadability",
            "ObjectReadability",
            "SerializedMetadata"
          ]
        },
        {
          "checkId": "AvatarClosure",
          "applicableFamilyKinds": [
            "ActorRouteFamily"
          ],
          "requiredFactKinds": [
            "AvatarId",
            "SkeletonId"
          ],
          "outcomeOnMissingFact": "Unchecked",
          "requiredEvidenceKinds": [
            "DependencyGraph",
            "SerializedMetadata"
          ]
        },
        {
          "checkId": "ControllerReferenceClassification",
          "applicableFamilyKinds": [
            "ActorRouteFamily"
          ],
          "requiredFactKinds": [
            "ControllerReferenceState"
          ],
          "outcomeOnMissingFact": "Unchecked",
          "requiredEvidenceKinds": [
            "SerializedMetadata"
          ]
        },
        {
          "checkId": "DependencyClosure",
          "applicableFamilyKinds": [
            "ActorRouteFamily"
          ],
          "requiredFactKinds": [
            "DependencyObjectIds"
          ],
          "outcomeOnMissingFact": "Unchecked",
          "requiredEvidenceKinds": [
            "DependencyGraph"
          ]
        },
        {
          "checkId": "MaterialDependencyClosure",
          "applicableFamilyKinds": [
            "ActorRouteFamily"
          ],
          "requiredFactKinds": [
            "RendererType",
            "ShaderFamilyIds"
          ],
          "outcomeOnMissingFact": "Unchecked",
          "requiredEvidenceKinds": [
            "DependencyGraph",
            "MaterialShaderGraph"
          ]
        },
        {
          "checkId": "MeshReadability",
          "applicableFamilyKinds": [
            "ActorRouteFamily"
          ],
          "requiredFactKinds": [
            "RendererType"
          ],
          "outcomeOnMissingFact": "Unchecked",
          "requiredEvidenceKinds": [
            "FileReadability",
            "ObjectReadability"
          ]
        },
        {
          "checkId": "SkeletonClosure",
          "applicableFamilyKinds": [
            "ActorRouteFamily"
          ],
          "requiredFactKinds": [
            "SkeletonId"
          ],
          "outcomeOnMissingFact": "Unchecked",
          "requiredEvidenceKinds": [
            "DependencyGraph",
            "SerializedMetadata"
          ]
        },
        {
          "checkId": "TextureDependencyClosure",
          "applicableFamilyKinds": [
            "ActorRouteFamily"
          ],
          "requiredFactKinds": [
            "ShaderFamilyIds"
          ],
          "outcomeOnMissingFact": "Unchecked",
          "requiredEvidenceKinds": [
            "DependencyGraph",
            "TextureMetadata"
          ]
        }
      ],
      "riskAxisDefinitions": [
        {
          "riskAxisId": "ActorRole",
          "applicableFamilyKinds": [
            "ActorRouteFamily"
          ],
          "sourceFactKinds": [
            "ActorRole",
            "PlatformVariant"
          ],
          "variantEncoding": "Tuple"
        },
        {
          "riskAxisId": "AnimationSetShape",
          "applicableFamilyKinds": [
            "ActorRouteFamily"
          ],
          "sourceFactKinds": [
            "AnimationSetShapeId",
            "PlatformVariant"
          ],
          "variantEncoding": "Tuple"
        },
        {
          "riskAxisId": "ControllerRoute",
          "applicableFamilyKinds": [
            "ActorRouteFamily"
          ],
          "sourceFactKinds": [
            "ControllerReferenceState",
            "PlatformVariant"
          ],
          "variantEncoding": "Tuple"
        },
        {
          "riskAxisId": "RendererShaderCombination",
          "applicableFamilyKinds": [
            "ActorRouteFamily"
          ],
          "sourceFactKinds": [
            "RendererType",
            "ShaderFamilyIds",
            "PlatformVariant"
          ],
          "variantEncoding": "Tuple"
        },
        {
          "riskAxisId": "SkeletonAvatar",
          "applicableFamilyKinds": [
            "ActorRouteFamily"
          ],
          "sourceFactKinds": [
            "SkeletonId",
            "AvatarId",
            "PlatformVariant"
          ],
          "variantEncoding": "Tuple"
        }
      ],
      "evidenceRequirementDefinitions": [
        {
          "evidenceRequirementId": "ActorRouteEvidence",
          "applicableRiskAxisIds": [
            "ActorRole",
            "AnimationSetShape",
            "ControllerRoute",
            "RendererShaderCombination",
            "SkeletonAvatar"
          ],
          "requiredEvidenceKinds": [
            "AnimationPlayback",
            "MaterialFidelity",
            "UnityImport",
            "VisibleRender"
          ],
          "acceptedExecutionStatuses": [
            "Completed"
          ]
        }
      ],
      "capabilityProjectionRules": [
        {
          "capabilityId": "EnemyModelSkeletonAnimationSet",
          "applicableFamilyKinds": [
            "ActorRouteFamily"
          ],
          "requiredRouteKinds": [
            "OriginalAsset",
            "PrototypeController"
          ],
          "allowedFamilyDecisions": [
            "PrototypeReplacement",
            "UseOriginalAsset"
          ],
          "requiredEvidenceKinds": [
            "AnimationPlayback",
            "MaterialFidelity",
            "UnityImport",
            "VisibleRender"
          ]
        },
        {
          "capabilityId": "PlayerModelSkeletonAnimationSet",
          "applicableFamilyKinds": [
            "ActorRouteFamily"
          ],
          "requiredRouteKinds": [
            "OriginalAsset",
            "PrototypeController"
          ],